{
  "schema": "GniFirebreakTraceV1",
  "schemaVersion": 1,
  "source": "emulator",
  "changed": true,
  "ceiling": 0.35,
  "boundaryTags": [
    "real_world_self_harm"
  ],
  "suppressedCounts": {
    "fields": 0,
    "dreamWeightDeltas": 0,
    "symbolEchoes": 0,
    "maskPressure": 0,
    "pacingDelta": 0
  },
  "clampCounts": {
    "dreamWeightDeltas": 1,
    "maskPressure": 0,
    "pacingDelta": 0
  }
}
